<?xml version="1.0" encoding="utf-8"?>
<firewall xmlns="http://www.wago.com/security/firewall"
          xmlns:xsi="http://www.w3.org/2001/XMLSchema-instance"
          xsi:schemaLocation="http://www.wago.com/security/firewall service.xsd">
    <ipv4>
        <service name="dns">
            <interfaces>
                <interface state="on"  if="br0"/>
                <interface state="on"  if="br1"/>
                <interface state="on"  if="br2"/>
                <interface state="on"  if="br3"/>
                <interface state="off" if="WAN"/>
                <interface state="off" if="VPN"/>
            </interfaces>
            <rules>
                <rule state="on" proto="tcpudp" dst_port="53"/>
            </rules>
        </service>
    </ipv4>
</firewall>
